{"contract_version":"1.0","scenario_id":"income-variation","forecast":{"minimum_balance_cents":200000,"minimum_balance_date":"2026-10-01","ending_balance_cents":500000,"first_negative_date":null},"risk":{"negative_balance_probability_ppm":0,"minimum_balance_p10_cents":200000,"minimum_balance_p50_cents":200000,"minimum_balance_p90_cents":200000,"ending_balance_p10_cents":473000,"ending_balance_p50_cents":501000,"ending_balance_p90_cents":527000,"projected_low_point_cents":200000,"safe_to_spend_cents":200000}}