{"contract_version":"1.0","scenario_id":"safe-to-spend","forecast":{"minimum_balance_cents":-45000,"minimum_balance_date":"2026-10-05","ending_balance_cents":45000,"first_negative_date":"2026-10-05"},"risk":{"negative_balance_probability_ppm":1000000,"minimum_balance_p10_cents":-47186,"minimum_balance_p50_cents":-45000,"minimum_balance_p90_cents":-45000,"ending_balance_p10_cents":22988,"ending_balance_p50_cents":38700,"ending_balance_p90_cents":48600,"projected_low_point_cents":-45000,"safe_to_spend_cents":-57186}}