{"contract_version":"1.0","scenario_id":"seeded-reproducibility","forecast":{"minimum_balance_cents":5000,"minimum_balance_date":"2026-10-05","ending_balance_cents":177000,"first_negative_date":null},"risk":{"negative_balance_probability_ppm":64000,"minimum_balance_p10_cents":5000,"minimum_balance_p50_cents":5000,"minimum_balance_p90_cents":5000,"ending_balance_p10_cents":155645,"ending_balance_p50_cents":170010,"ending_balance_p90_cents":181500,"projected_low_point_cents":5000,"safe_to_spend_cents":5000}}